{
  "schema_version": "s12-engine-sound-v12-source-profile-1",
  "source": {
    "engine_kind": {"value":"piston","unit":"enum","range":["piston","rotary"],"source_level":"C","source":"synthetic","source_url":"","source_scope":"Synthetic GT-R-style V6 source; not OEM calibration.","verification_state":"synthetic_assumption"},
    "cylinders": {"value":6,"unit":"count","range":[0,12],"source_level":"C","source":"synthetic","source_url":"","source_scope":"Synthetic six-cylinder topology; not OEM calibration.","verification_state":"synthetic_assumption"},
    "rotor_count": {"value":0,"unit":"count","range":[0,2],"source_level":"C","source":"synthetic","source_url":"","source_scope":"Synthetic piston topology; not OEM calibration.","verification_state":"synthetic_assumption"},
    "chambers_per_rotor": {"value":0,"unit":"count","range":[0,3],"source_level":"C","source":"synthetic","source_url":"","source_scope":"Synthetic piston topology; not OEM calibration.","verification_state":"synthetic_assumption"},
    "shaft_turns_per_rotor_turn": {"value":1,"unit":"ratio","range":[1,3],"source_level":"C","source":"synthetic","source_url":"","source_scope":"Synthetic piston topology; not OEM calibration.","verification_state":"synthetic_assumption"},
    "layout": {"value":"V","unit":"enum","range":["inline","V","rotary"],"source_level":"C","source":"synthetic","source_url":"","source_scope":"Synthetic V6 layout; not OEM calibration.","verification_state":"synthetic_assumption"},
    "firing_order": {"value":[1,2,3,4,5,6],"unit":"event_id","range":[1,6],"source_level":"C","source":"synthetic","source_url":"","source_scope":"Synthetic even-fire event identifiers; not OEM firing-order evidence.","verification_state":"synthetic_assumption"},
    "firing_phases_deg": {"value":[0,120,240,360,480,600],"unit":"deg_720_cycle","range":[0,719],"source_level":"C","source":"synthetic","source_url":"","source_scope":"Synthetic even-fire phase map; not OEM timing evidence.","verification_state":"synthetic_assumption"},
    "bank_map": {"value":[-1,1,-1,1,-1,1],"unit":"bank_sign","range":[-1,1],"source_level":"C","source":"synthetic","source_url":"","source_scope":"Synthetic V6 bank map; not OEM timing evidence.","verification_state":"synthetic_assumption"},
    "pulse_sharpness": {"value":0.62,"unit":"ratio","range":[0,1],"source_level":"C","source":"synthetic","source_url":"","source_scope":"Synthetic crisp V6 pulse; not OEM calibration.","verification_state":"synthetic_assumption"},
    "combustion_gain": {"value":0.68,"unit":"linear","range":[0,1],"source_level":"C","source":"synthetic","source_url":"","source_scope":"Synthetic GT-R exhaust body; not OEM calibration.","verification_state":"synthetic_assumption"},
    "intake_gain": {"value":0.20,"unit":"linear","range":[0,1],"source_level":"C","source":"synthetic","source_url":"","source_scope":"Synthetic V6 intake edge; not OEM calibration.","verification_state":"synthetic_assumption"},
    "induction_gain": {"value":0.12,"unit":"linear","range":[0,1],"source_level":"C","source":"synthetic","source_url":"","source_scope":"Synthetic twin-turbo layer; not OEM calibration.","verification_state":"synthetic_assumption"},
    "mechanical_gain": {"value":0.10,"unit":"linear","range":[0,1],"source_level":"C","source":"synthetic","source_url":"","source_scope":"Synthetic V6 mechanical texture; not OEM calibration.","verification_state":"synthetic_assumption"},
    "flow_gain": {"value":0.12,"unit":"linear","range":[0,1],"source_level":"C","source":"synthetic","source_url":"","source_scope":"Synthetic high-load exhaust flow; not OEM calibration.","verification_state":"synthetic_assumption"},
    "order_surface": [
      {"order":{"value":3,"unit":"order","range":[0.5,18],"source_level":"C","source":"synthetic","source_url":"","source_scope":"Synthetic V6 firing order surface; not OEM calibration.","verification_state":"synthetic_assumption"},"rpm_nodes":{"value":[900,3500,7000],"unit":"rpm","range":[0,12000],"source_level":"C","source":"synthetic","source_url":"","source_scope":"Synthetic V6 RPM surface; not OEM calibration.","verification_state":"synthetic_assumption"},"low_load_gains":{"value":[0.54,0.48,0.36],"unit":"linear","range":[0,1],"source_level":"C","source":"synthetic","source_url":"","source_scope":"Synthetic V6 low-load order balance; not OEM calibration.","verification_state":"synthetic_assumption"},"high_load_gains":{"value":[0.62,0.72,0.84],"unit":"linear","range":[0,1],"source_level":"C","source":"synthetic","source_url":"","source_scope":"Synthetic V6 high-load order balance; not OEM calibration.","verification_state":"synthetic_assumption"},"phase_rad":{"value":[0,0.05,0.12],"unit":"rad","range":[-3.141593,3.141593],"source_level":"C","source":"synthetic","source_url":"","source_scope":"Synthetic V6 phase surface; not OEM calibration.","verification_state":"synthetic_assumption"}},
      {"order":{"value":6,"unit":"order","range":[0.5,18],"source_level":"C","source":"synthetic","source_url":"","source_scope":"Synthetic V6 harmonic surface; not OEM calibration.","verification_state":"synthetic_assumption"},"rpm_nodes":{"value":[900,3500,7000],"unit":"rpm","range":[0,12000],"source_level":"C","source":"synthetic","source_url":"","source_scope":"Synthetic V6 RPM surface; not OEM calibration.","verification_state":"synthetic_assumption"},"low_load_gains":{"value":[0.28,0.34,0.40],"unit":"linear","range":[0,1],"source_level":"C","source":"synthetic","source_url":"","source_scope":"Synthetic V6 low-load harmonic balance; not OEM calibration.","verification_state":"synthetic_assumption"},"high_load_gains":{"value":[0.40,0.54,0.72],"unit":"linear","range":[0,1],"source_level":"C","source":"synthetic","source_url":"","source_scope":"Synthetic V6 high-load harmonic balance; not OEM calibration.","verification_state":"synthetic_assumption"},"phase_rad":{"value":[0.10,0.16,0.24],"unit":"rad","range":[-3.141593,3.141593],"source_level":"C","source":"synthetic","source_url":"","source_scope":"Synthetic V6 phase surface; not OEM calibration.","verification_state":"synthetic_assumption"}},
      {"order":{"value":12,"unit":"order","range":[0.5,18],"source_level":"C","source":"synthetic","source_url":"","source_scope":"Synthetic GT-R high-order edge; not OEM calibration.","verification_state":"synthetic_assumption"},"rpm_nodes":{"value":[900,3500,7000],"unit":"rpm","range":[0,12000],"source_level":"C","source":"synthetic","source_url":"","source_scope":"Synthetic V6 RPM surface; not OEM calibration.","verification_state":"synthetic_assumption"},"low_load_gains":{"value":[0.02,0.05,0.10],"unit":"linear","range":[0,1],"source_level":"C","source":"synthetic","source_url":"","source_scope":"Synthetic V6 low-load edge; not OEM calibration.","verification_state":"synthetic_assumption"},"high_load_gains":{"value":[0.04,0.10,0.18],"unit":"linear","range":[0,1],"source_level":"C","source":"synthetic","source_url":"","source_scope":"Synthetic V6 high-load edge; not OEM calibration.","verification_state":"synthetic_assumption"},"phase_rad":{"value":[0.18,0.24,0.34],"unit":"rad","range":[-3.141593,3.141593],"source_level":"C","source":"synthetic","source_url":"","source_scope":"Synthetic V6 phase surface; not OEM calibration.","verification_state":"synthetic_assumption"}}
    ]
  },
  "transient": {"acceleration_attack_gain":{"value":0.22,"unit":"linear","range":[0,1],"source_level":"C","source":"synthetic","source_url":"","source_scope":"Synthetic GT-R torque transient; not OEM calibration.","verification_state":"synthetic_assumption"},"lift_decay_gain":{"value":0.24,"unit":"linear","range":[0,1],"source_level":"C","source":"synthetic","source_url":"","source_scope":"Synthetic GT-R lift transient; not OEM calibration.","verification_state":"synthetic_assumption"}},
  "gearbox": {"torque_cut_gain":{"value":0.28,"unit":"linear","range":[0,1],"source_level":"C","source":"synthetic","source_url":"","source_scope":"Synthetic DCT torque cut; not OEM calibration.","verification_state":"synthetic_assumption"},"shift_bark_gain":{"value":0.34,"unit":"linear","range":[0,1],"source_level":"C","source":"synthetic","source_url":"","source_scope":"Synthetic shift bark; not OEM calibration.","verification_state":"synthetic_assumption"}},
  "afterfire": {"upshift_bark_gain":{"value":0.12,"unit":"linear","range":[0,1],"source_level":"C","source":"synthetic","source_url":"","source_scope":"Synthetic GT-R upshift bark; not OEM calibration.","verification_state":"synthetic_assumption"},"downshift_blip_pop_gain":{"value":0.10,"unit":"linear","range":[0,1],"source_level":"C","source":"synthetic","source_url":"","source_scope":"Synthetic GT-R downshift blip; not OEM calibration.","verification_state":"synthetic_assumption"},"overrun_crackle_gain":{"value":0.18,"unit":"linear","range":[0,1],"source_level":"C","source":"synthetic","source_url":"","source_scope":"Synthetic GT-R restrained overrun; not OEM calibration.","verification_state":"synthetic_assumption"}}
}
