{
  "schema_version": "s12-engine-sound-v12-source-profile-1",
  "source": {
    "engine_kind": {"value": "piston", "unit": "enum", "range": ["piston", "rotary"], "source_level": "C", "source": "synthetic", "source_url": "", "source_scope": "Synthetic S12 v1.2 provisional source tuning; not OEM calibration.", "verification_state": "synthetic_assumption"},
    "cylinders": {"value": 8, "unit": "count", "range": [0, 12], "source_level": "C", "source": "synthetic", "source_url": "", "source_scope": "Synthetic S12 v1.2 provisional source tuning; not OEM calibration.", "verification_state": "synthetic_assumption"},
    "rotor_count": {"value": 0, "unit": "count", "range": [0, 2], "source_level": "C", "source": "synthetic", "source_url": "", "source_scope": "Synthetic S12 v1.2 provisional source tuning; not OEM calibration.", "verification_state": "synthetic_assumption"},
    "chambers_per_rotor": {"value": 0, "unit": "count", "range": [0, 3], "source_level": "C", "source": "synthetic", "source_url": "", "source_scope": "Synthetic S12 v1.2 provisional source tuning; not OEM calibration.", "verification_state": "synthetic_assumption"},
    "shaft_turns_per_rotor_turn": {"value": 1, "unit": "ratio", "range": [1, 3], "source_level": "C", "source": "synthetic", "source_url": "", "source_scope": "Synthetic S12 v1.2 provisional source tuning; not OEM calibration.", "verification_state": "synthetic_assumption"},
    "layout": {"value": "V", "unit": "enum", "range": ["inline", "V", "rotary"], "source_level": "C", "source": "synthetic", "source_url": "", "source_scope": "Synthetic S12 v1.2 provisional source tuning; not OEM calibration.", "verification_state": "synthetic_assumption"},
    "firing_order": {"value": [1, 5, 4, 8, 3, 7, 2, 6], "unit": "event_id", "range": [1, 8], "source_level": "C", "source": "synthetic", "source_url": "", "source_scope": "Synthetic S12 event identifiers; not OEM firing-order evidence.", "verification_state": "synthetic_assumption"},
    "firing_phases_deg": {"value": [0, 540, 360, 180, 90, 630, 450, 270], "unit": "deg_720_cycle", "range": [0, 719], "source_level": "C", "source": "synthetic", "source_url": "", "source_scope": "Synthetic S12 event phase map; not OEM timing evidence.", "verification_state": "synthetic_assumption"},
    "bank_map": {"value": [-1, 1, -1, 1, 1, -1, 1, -1], "unit": "bank_sign", "range": [-1, 1], "source_level": "C", "source": "synthetic", "source_url": "", "source_scope": "Synthetic S12 bank asymmetry map; not OEM layout timing evidence.", "verification_state": "synthetic_assumption"},
    "pulse_sharpness": {"value": 0.55, "unit": "ratio", "range": [0, 1], "source_level": "C", "source": "synthetic", "source_url": "", "source_scope": "Synthetic S12 provisional source tuning; not OEM calibration.", "verification_state": "synthetic_assumption"},
    "combustion_gain": {"value": 0.55, "unit": "linear", "range": [0, 1], "source_level": "C", "source": "synthetic", "source_url": "", "source_scope": "Synthetic S12 provisional source tuning; not OEM calibration.", "verification_state": "synthetic_assumption"},
    "intake_gain": {"value": 0.36, "unit": "linear", "range": [0, 1], "source_level": "C", "source": "synthetic", "source_url": "", "source_scope": "Synthetic high-RPM intake layer, not a measured OEM signature.", "verification_state": "synthetic_assumption"},
    "induction_gain": {"value": 0.10, "unit": "linear", "range": [0, 1], "source_level": "C", "source": "synthetic", "source_url": "", "source_scope": "Synthetic naturally-aspirated source layer; not OEM calibration.", "verification_state": "synthetic_assumption"},
    "mechanical_gain": {"value": 0.20, "unit": "linear", "range": [0, 1], "source_level": "C", "source": "synthetic", "source_url": "", "source_scope": "Synthetic S12 provisional source tuning; not OEM calibration.", "verification_state": "synthetic_assumption"},
    "flow_gain": {"value": 0.52, "unit": "linear", "range": [0, 1], "source_level": "C", "source": "synthetic", "source_url": "", "source_scope": "Synthetic high-RPM flow layer, not a measured OEM signature.", "verification_state": "synthetic_assumption"},
    "order_surface": [
      {"order": {"value": 4, "unit": "order", "range": [0.5, 8], "source_level": "C", "source": "synthetic", "source_url": "", "source_scope": "Synthetic order surface; not OEM calibration.", "verification_state": "synthetic_assumption"}, "rpm_nodes": {"value": [1000, 5000, 9000], "unit": "rpm", "range": [0, 12000], "source_level": "C", "source": "synthetic", "source_url": "", "source_scope": "Synthetic order surface; not OEM calibration.", "verification_state": "synthetic_assumption"}, "low_load_gains": {"value": [0.40, 0.50, 0.60], "unit": "linear", "range": [0, 1], "source_level": "C", "source": "synthetic", "source_url": "", "source_scope": "Synthetic order surface; not OEM calibration.", "verification_state": "synthetic_assumption"}, "high_load_gains": {"value": [0.50, 0.70, 0.85], "unit": "linear", "range": [0, 1], "source_level": "C", "source": "synthetic", "source_url": "", "source_scope": "Synthetic order surface; not OEM calibration.", "verification_state": "synthetic_assumption"}, "phase_rad": {"value": [0, 0.08, 0.16], "unit": "rad", "range": [-3.141593, 3.141593], "source_level": "C", "source": "synthetic", "source_url": "", "source_scope": "Synthetic order surface; not OEM calibration.", "verification_state": "synthetic_assumption"}},
      {"order": {"value": 6, "unit": "order", "range": [0.5, 8], "source_level": "C", "source": "synthetic", "source_url": "", "source_scope": "Synthetic order surface; not OEM calibration.", "verification_state": "synthetic_assumption"}, "rpm_nodes": {"value": [1000, 5000, 9000], "unit": "rpm", "range": [0, 12000], "source_level": "C", "source": "synthetic", "source_url": "", "source_scope": "Synthetic order surface; not OEM calibration.", "verification_state": "synthetic_assumption"}, "low_load_gains": {"value": [0.20, 0.30, 0.45], "unit": "linear", "range": [0, 1], "source_level": "C", "source": "synthetic", "source_url": "", "source_scope": "Synthetic order surface; not OEM calibration.", "verification_state": "synthetic_assumption"}, "high_load_gains": {"value": [0.25, 0.55, 0.78], "unit": "linear", "range": [0, 1], "source_level": "C", "source": "synthetic", "source_url": "", "source_scope": "Synthetic order surface; not OEM calibration.", "verification_state": "synthetic_assumption"}, "phase_rad": {"value": [0.10, 0.18, 0.25], "unit": "rad", "range": [-3.141593, 3.141593], "source_level": "C", "source": "synthetic", "source_url": "", "source_scope": "Synthetic order surface; not OEM calibration.", "verification_state": "synthetic_assumption"}},
      {"order": {"value": 8, "unit": "order", "range": [0.5, 8], "source_level": "C", "source": "synthetic", "source_url": "", "source_scope": "Synthetic order surface; not OEM calibration.", "verification_state": "synthetic_assumption"}, "rpm_nodes": {"value": [1000, 5000, 9000], "unit": "rpm", "range": [0, 12000], "source_level": "C", "source": "synthetic", "source_url": "", "source_scope": "Synthetic order surface; not OEM calibration.", "verification_state": "synthetic_assumption"}, "low_load_gains": {"value": [0.08, 0.16, 0.30], "unit": "linear", "range": [0, 1], "source_level": "C", "source": "synthetic", "source_url": "", "source_scope": "Synthetic order surface; not OEM calibration.", "verification_state": "synthetic_assumption"}, "high_load_gains": {"value": [0.12, 0.35, 0.70], "unit": "linear", "range": [0, 1], "source_level": "C", "source": "synthetic", "source_url": "", "source_scope": "Synthetic order surface; not OEM calibration.", "verification_state": "synthetic_assumption"}, "phase_rad": {"value": [0.20, 0.30, 0.42], "unit": "rad", "range": [-3.141593, 3.141593], "source_level": "C", "source": "synthetic", "source_url": "", "source_scope": "Synthetic order surface; not OEM calibration.", "verification_state": "synthetic_assumption"}}
    ]
  },
  "transient": {"acceleration_attack_gain": {"value": 0.30, "unit": "linear", "range": [0, 1], "source_level": "C", "source": "synthetic", "source_url": "", "source_scope": "Synthetic S12 provisional source tuning; not OEM calibration.", "verification_state": "synthetic_assumption"}, "lift_decay_gain": {"value": 0.25, "unit": "linear", "range": [0, 1], "source_level": "C", "source": "synthetic", "source_url": "", "source_scope": "Synthetic S12 provisional source tuning; not OEM calibration.", "verification_state": "synthetic_assumption"}},
  "gearbox": {"torque_cut_gain": {"value": 0.48, "unit": "linear", "range": [0, 1], "source_level": "C", "source": "synthetic", "source_url": "", "source_scope": "Synthetic gearbox transient; not OEM calibration.", "verification_state": "synthetic_assumption"}, "shift_bark_gain": {"value": 0.52, "unit": "linear", "range": [0, 1], "source_level": "C", "source": "synthetic", "source_url": "", "source_scope": "Synthetic gearbox transient; not OEM calibration.", "verification_state": "synthetic_assumption"}},
  "afterfire": {"upshift_bark_gain": {"value": 0.20, "unit": "linear", "range": [0, 1], "source_level": "C", "source": "synthetic", "source_url": "", "source_scope": "Synthetic afterfire before PTR; not OEM calibration.", "verification_state": "synthetic_assumption"}, "downshift_blip_pop_gain": {"value": 0.18, "unit": "linear", "range": [0, 1], "source_level": "C", "source": "synthetic", "source_url": "", "source_scope": "Synthetic afterfire before PTR; not OEM calibration.", "verification_state": "synthetic_assumption"}, "overrun_crackle_gain": {"value": 0.10, "unit": "linear", "range": [0, 1], "source_level": "C", "source": "synthetic", "source_url": "", "source_scope": "Synthetic afterfire before PTR; not OEM calibration.", "verification_state": "synthetic_assumption"}}
}
